Exploring winter textures through a sensory treasure basket,exploring-winter-textures-through-a-sensory-treasure-basket,698734a9856055bb42014e7a,697d0e954fa31fe0657499ab,698f5799ad72c2f636073285,false,false,Fri Feb 13 2026 16:55:53 GMT+0000 (Coordinated Universal Time),Sat Feb 21 2026 10:51:49 GMT+0000 (Coordinated Universal Time),Sat Feb 21 2026 11:00:50 GMT+0000 (Coordinated Universal Time),https://cdn.prod.website-files.com/697d0e954fa31fe0657499ac/699786768e4bd0a03b1b8062_6588633d-ce05-4c93-97c4-cce47f50fd98.png,winter; eco-friendly; montessori; sorting; problem-solving,,"<p>This activity offers children repeated opportunities to explore cold, soft and natural textures while playing alongside others. It creates space for shared attention, early conversation and imaginative use of materials, with adults supporting language, turn-taking and emotional expression.</p>","<p>Adults may observe how long children remain engaged, which materials they return to, and how they use scoops or hands to move items. Pay attention to body language and facial expressions, especially when children encounter cold ice or negotiate space and resources. Notice the winter-related words children already use, how they communicate needs non-verbally, and how they respond when problems arise during shared play.</p>","<ul><li>Medium wicker or soft fabric basket</li><li>Scarves (varied textures)</li><li>Soft winter hats</li><li>Wooden spoons</li><li>Pinecones (large, intact)</li><li>Natural sponges</li><li>Small piece of silver or metallic fabric</li><li>Floor mat or rug</li></ul>",,"<ol><li>Place the basket on a soft mat in a quiet, warm space.</li><li>Sit nearby at the child’s level without crowding them.</li><li>Allow the child to approach the basket independently.</li><li>Resist handing items immediately. Wait for the child to reach.</li><li>When the child picks up an object, offer calm commentary:<ul><li>“Soft scarf.”</li><li>“Cold spoon.”</li><li>“You’re squeezing the sponge.”</li></ul></li><li>Mirror facial expressions and respond to sounds.</li><li>If interest fades, gently rotate one item back into view rather than introducing something new.</li></ol><p><strong>The basket remains open-ended. There is no expectation to use objects in a particular way.</strong></p>","<p>The adult’s primary role is emotional regulation and language modelling. Stay physically close but not intrusive. </p><p>Use simple, concrete language describing what the child is doing. Avoid quizzing or directing (“What is it?” “Can you find…?”). </p><p>Notice when the child needs reassurance and respond with tone and presence. Ensure items remain safe and intact throughout play. </p><p>The adult names textures, temperatures and actions without overstimulation. The focus is shared attention, not performance.</p>",Place the basket within reach during tummy time or supported sitting. Limit the contents to 4–5 larger items. Focus on secure attachment. The adult mirrors expressions and keeps language rhythmic and repetitive. Objects may be explored with the mouth; hygiene and safety are prioritised.,"Increase the number of items slightly. Children may begin transferring objects in and out of the basket. Add simple action words: “pull,” “drop,” “shake.” Allow children to carry items short distances. Support early independence while staying emotionally available.",,,,Quiet indoor floor space large enough for one or two children to sit comfortably.,"10–20 minutes, depending on engagement.",Supervise at all times. Check pinecones for sharp edges or loose pieces. Ensure all items are large enough to prevent choking. Remove any damaged materials immediately. Wash fabric items regularly.,"<h3>Physical Development </h3><p>Children practise grasping, squeezing, transferring and reaching, strengthening fine motor control and coordination.</p><h3>Communication and Language </h3><p>Adult commentary supports early vocabulary and listening skills through repeated exposure to simple descriptive language.</p><h3>Personal, Social and Emotional Development (PSED)</h3><p>Calm shared exploration builds security, confidence and early independence.</p>",https://cdn.prod.website-files.com/697d0e954fa31fe0657499ac/69998e021fea973e06a6e643_8aa8890c-7d4d-4dca-8ab1-6348ccb3ad98.png,"<p>Use a low shelf rather than a basket so each item is clearly visible and spaced apart. Limit materials to high-quality natural objects with clear sensory differences. The adult steps further back physically, allowing uninterrupted concentration. Language is precise and minimal. Observation focuses on repetition and the child’s independent choice-making rather than shared interaction.</p><p>‍</p>",https://cdn.prod.website-files.com/697d0e954fa31fe0657499ac/699788b277a5c18ba6ded0bf_5577d963-501d-458c-af32-7141ad76dac7.png,"<p>Move the activity outdoors on a dry blanket. Replace scarves and hats with natural winter finds such as bark, evergreen sprigs and smooth stones. The adult draws attention to temperature differences in real air conditions. Observation focuses on how children respond to natural sensory variation such as breeze, cold and uneven textures.</p>",https://cdn.prod.website-files.com/697d0e954fa31fe0657499ac/69998e220f934b427ccfb5f0_d0f9be0e-373a-4b97-8830-4b693453eeb7.png,"<p>Arrange the basket near natural light with a neutral backdrop to emphasise texture and shadow. Add a mirror panel behind the objects so children can see movement and fabric shimmer. The adult documents which materials attract longest engagement using brief notes or photographs. During play, the adult responds to gestures as communication, treating the child as an intentional explorer. The environment is adjusted over time based on observed interests.</p>",https://cdn.prod.website-files.com/697d0e954fa31fe0657499ac/6997903dc184c1d6206011cc_a13afd38-94b6-407c-af71-a93268a376ea.png,"<p>Select muted, natural fibres such as wool and cotton. Reduce the number of objects and introduce them slowly. The adult uses gentle, rhythmic language and slower movements. Attention is placed on maintaining a calm atmosphere and predictable flow rather than varied stimulation.</p>",false,false,,
Melting ice to rescue winter animals using pipettes and warm water,melting-ice-to-rescue-winter-animals-using-pipettes-and-warm-water,698734a9856055bb42014e7a,697d0e954fa31fe0657499ab,698f504c156e0a6ca180393c,false,true,Fri Feb 13 2026 16:24:44 GMT+0000 (Coordinated Universal Time),Sat Feb 21 2026 09:47:01 GMT+0000 (Coordinated Universal Time),Fri Feb 20 2026 11:24:23 GMT+0000 (Coordinated Universal Time),https://cdn.prod.website-files.com/697d0e954fa31fe0657499ac/698f52777915ca645f54af47_096ccf5e-f78e-4292-9444-a950865a8674.png,winter; small-world-play; problem-solving; tuff-tray,,<p>This activity gives children repeated chances to notice cause and effect as they apply warm water to ice and watch it change. They experience the difference between solid and liquid in a concrete way. They practise controlled hand movements while using pipettes. They explore simple ideas about animal habitats in winter.</p><p>‍</p>,"<ul><li>Children noticing that “more water” speeds up melting</li><li>Language such as “cold”, “frozen”, “melting”, “water”, “ice”</li><li>Attempts to solve the problem in different ways</li><li>Fine motor control when squeezing and releasing pipettes</li><li>Cooperative behaviour when sharing bowls or animals</li><li>Emotional responses to waiting, success, or frustration</li></ul>",<ol><li>Builders tuff tray </li><li>Small world animals (wildlife or winter animals)</li><li>Activity trays or plastic containers for freezing </li><li>Two bowls of warm water</li><li>Pipettes</li><li>Natural materials such as leaves and twigs</li><li>Towels or cloths for spills</li></ol>,,"<p>Place natural materials across the base of the tuff tray to create a simple winter landscape.Position the frozen animal blocks around the tray within easy reach.Place pipettes around the tray edge. Keep bowls of warm water on a nearby table to reduce spills.Gather children briefly and explain that the animals are trapped in ice. Demonstrate drawing water into the pipette and gently releasing it onto the ice.Step back. Allow children to choose an ice block and begin exploring.Model language sparingly: “The ice feels hard.” “The water is warm.” “It is starting to melt.”Once animals are freed, encourage children to place them into the winter landscape and talk about where they might live.Keep the pace unhurried. The waiting is part of the learning.</p>","<ul><li>Stay emotionally available and observant. Offer help only when needed.</li><li>Model precise language linked to what children can see and feel. Avoid abstract explanations.</li><li>Support turn-taking where necessary. Narrate problem-solving attempts without taking control.</li><li>Monitor temperature and comfort. Ensure children’s hands are not becoming too cold.</li><li>Notice effort rather than speed. The focus is exploration, not rescue time.</li></ul>",,"Use larger ice blocks with partially exposed animals. Offer fewer materials. Focus on squeezing, pouring and feeling temperature differences. Keep language simple and repetitive.",Encourage simple problem-solving: “What could we try?” Support early imaginative play once animals are freed. Model short two- to three-word phrases.,Invite prediction: “What do you think will happen if we add more water?” Introduce vocabulary such as “solid” and “liquid” in context. Encourage cooperative rescue attempts.,"Extend into discussion about habitats and seasons. Ask children to explain their thinking. Introduce measuring language such as “faster”, “slower”, “more”, “less”.",Table space for a builders tuff tray and a nearby surface for warm water bowls.,"30–45 minutes, depending on ice size and group engagement.","Check water is warm, never hot.

Mop spills immediately.

Monitor children for cold hands.

Demonstrate safe pipette use to prevent snapping or finger pinching.",<h3>Understanding the World</h3><p>Children observe changes in materials and explore seasonal context. </p><h3>Physical Development</h3><p>Squeezing pipettes strengthens fine motor control and hand–eye coordination. </p><h3>Communication &amp; Language</h3><p>Children describe what they see and hear new vocabulary modelled in context. </p><h3>PSED</h3><p>Turn-taking and managing frustration support emotional development.</p>,,"<p>Prepare a defined workspace with individual trays rather than one shared tuff tray. Limit each child to one ice block, one pipette and one bowl of warm water. Use real ceramic or glass bowls where safe, to reinforce care of materials.The adult demonstrates the full sequence slowly once, then withdraws. Interruptions are minimised. The adult observes grip control, independence, and whether the child returns materials to their place without prompting.</p>",,"<p>Run the activity outdoors using natural frost or ice where possible. Replace pipettes with small natural scoops or collected shells. Use water warmed in insulated flasks.The adult supports safe risk-taking in cold conditions. Attention is given to weather, changing temperature and the natural environment. Discussion centres on real seasonal changes rather than small world play alone.</p>",,"<p>Create an inquiry table with light beneath a clear tray so children can see the ice changing from different angles. Add clipboards and pencils nearby for mark-making. Display photographs of ice, frost and winter habitats at child height.The adult listens for theories about why the ice melts. Children’s ideas are documented with notes or photographs and revisited later. The environment remains flexible and may be adjusted based on children’s emerging questions.</p>",,"<p>Begin with a short seasonal story about animals resting beneath winter ice. Use muted, natural fabrics beneath the ice blocks. Keep materials simple and limited.The adult maintains a calm rhythm in speech and movement. Focus remains on sensory experience and imagination rather than scientific explanation. Children are allowed extended quiet time to observe the slow melting process.</p>",false,false,,
Observing and recording daily weather using clipboards and weather symbols,observing-and-recording-daily-weather-using-clipboards-and-weather-symbols,698734a9856055bb42014e7a,697d0e954fa31fe0657499ab,698f504d927458054371accb,false,true,Fri Feb 13 2026 16:24:45 GMT+0000 (Coordinated Universal Time),Fri Feb 20 2026 16:00:49 GMT+0000 (Coordinated Universal Time),Fri Feb 20 2026 11:27:04 GMT+0000 (Coordinated Universal Time),https://cdn.prod.website-files.com/697d0e954fa31fe0657499ac/698f5167ac5665802609c8e3_Observing%20and%20recording%20daily%20weather%20using%20clipboards%20and%20weather%20symbols.png,nature-rainbows-and-weather; outdoor-exploration; mark-making,,<ul><li>Children explore how to identify and describe weather using simple vocabulary.</li><li>They notice seasonal patterns and talk about change over time.</li><li>They make marks with meaning as they record what they observe.</li><li>They sort and match weather symbols to what they can see in the sky.</li></ul>,"<ul><li>Use descriptive words such as sunny, cloudy, windy, cold or warm</li><li>Notice differences across days (“It was raining yesterday”)</li><li>Attempt to represent weather through lines, symbols or early writing</li><li>Choose to work alone, alongside others, or collaboratively</li><li>Sustain attention outdoors and return to the task independently</li></ul>","<ul><li>Paper</li><li>Pencils</li><li>Clipboards</li><li>Binoculars</li></ul><p><strong>Additional resources:</strong></p><ul><li>Weather symbol cards (sun, rain, wind, snow, clouds)</li><li>Interactive weather board or simple display chart</li><li>Tablet or printed weather images (optional reference only)</li><li>Cushions or outdoor seating area</li></ul>",,"<p>Prepare a comfortable base area with cushions indoors or outdoors.Place clipboards, paper and pencils on a table for children to collect independently.Lay out weather symbol cards clearly on a mat or easel.Introduce the activity by inviting children to step outside and “check the sky.”Model looking carefully. Use binoculars to focus attention upwards and across the horizon.Ask simple noticing prompts such as “What can you see?” or “Is the sky the same colour everywhere?”Return to the base area and invite children to choose a weather card that matches what they observed.Encourage children to record what they noticed using marks, drawings, or early letters.Add their chosen symbol or drawing to the interactive weather board.Keep the pace steady. Allow children to revisit the observation more than once in the same session.</p>","<ul><li>Stay alongside rather than directing.</li><li>Model precise vocabulary without overloading language.</li><li>Repeat and extend children’s words (“Yes, it is cloudy. The clouds are thick and grey.”).</li><li>Encourage mark making without correcting form.</li><li>Support turn-taking around binoculars and shared materials.</li><li>Maintain awareness of weather conditions and adapt if needed.</li><li>Notice who observes carefully, who prefers movement, and who returns to add detail later.</li></ul>",,"Focus on sensory noticing rather than recording.
Go outside briefly and name what can be felt: wind on cheeks, warmth on hands.
Offer large crayons instead of pencils.
Adults scribe single words while children watch.","Introduce two clear weather choices at a time.
Encourage simple marks such as dots for rain or lines for wind.
Use repetition daily to build confidence in naming.","Invite comparison with yesterday.
Encourage children to explain their choice of symbol.
Begin simple sorting such as grouping sunny days together.","Introduce a weekly weather chart.
Encourage early phonetic spelling of weather words.
Invite children to predict tomorrow’s weather and explain their thinking.",Access to a safe outdoor area plus a calm indoor or sheltered base space for recording.,"15–25 minutes, depending on discussion length and age group.","Check outdoor conditions before beginning. Avoid high winds or unsafe weather.

Ensure pencils are appropriately sharpened.

Model safe handling of clipboards.

Supervise binocular use and outdoor boundaries.",<h3>Communication and Language</h3><p>Children develop vocabulary through real observation and discussion. </p><h3>Understanding the World</h3><p>Children notice seasonal change and explore the natural environment directly. </p><h3>Literacy</h3><p>Children make marks with meaning and begin linking symbols to spoken words. </p><h3>Mathematics</h3><p>Sorting and categorising weather symbols introduces early data handling.</p>,,"<p>Prepare a small, ordered weather station with real tools only. Limit symbol cards to the current season to reduce distraction. Place clipboards neatly on a tray for independent collection.Stand back after the initial introduction. Avoid prompting once a child is engaged. Observe how they categorise weather without correction. Pay attention to repetition and independence in returning to the task daily.</p>",,<p>Move the entire activity outdoors. Use natural markers such as sticks to draw symbols in soil before transferring to paper. Encourage children to feel wind direction and notice changes in light.Adopt a slower pace. Allow managed risk such as standing in light rain. Observe resilience and problem-solving in adapting to weather conditions rather than focusing on the finished recording.</p>,,<p>Create a visible documentation wall showing previous days’ weather recordings. Add photographs of the sky taken by children. Arrange materials attractively to invite discussion.Position yourself as a co-researcher. Ask open questions that extend thinking. Record children’s explanations alongside their drawings. Notice how their theories about weather change over time.</p>,,"<p>Introduce the activity through a short seasonal verse or simple rhythmic chant. Use soft-coloured pencils and natural materials. Keep visual displays uncluttered.Use gentle, descriptive language rather than direct questioning. Pay attention to mood and atmosphere as much as vocabulary. Observe how children express weather through colour and movement as well as drawing.</p>",false,false,,
Practising dressing skills using real winter clothing,practising-dressing-skills-using-real-winter-clothing,698734a9856055bb42014e7a,697d0e954fa31fe0657499ab,69873ca520034ae66daac2fc,false,true,Sat Feb 07 2026 13:22:45 GMT+0000 (Coordinated Universal Time),Sat Feb 21 2026 09:49:37 GMT+0000 (Coordinated Universal Time),Fri Feb 20 2026 11:24:23 GMT+0000 (Coordinated Universal Time),https://cdn.prod.website-files.com/697d0e954fa31fe0657499ac/698f5499469b4d47089b427c_89327507-9814-485c-bc00-1fabcd633e45.png,winter; autumn; dressing; sorting; role-play; outdoor-exploration; problem-solving; all-about-me,,"<p>This activity gives children repeated chances to practise dressing skills using real outdoor clothing. It supports growing independence, body awareness, and confidence in caring for themselves.</p><p>‍</p>","<ul><li>Attempting to put items on in different ways before asking for help</li><li>Persisting with fastenings or abandoning them quickly</li><li>Naming items and body parts, or using gesture to communicate intent</li><li>Watching or copying peers, offering help, or negotiating turns</li><li>Showing frustration, pride, or satisfaction through facial expression and posture</li></ul>",<p>A selection of winter clothing from the setting: </p><ul><li>Coats</li><li>Hats</li><li>Scarves</li><li>Gloves</li><li>Wellies</li></ul><p>Use items children are already familiar with. </p><p>Avoid adding novelty clothing that distracts from the focus on self-care.</p>,,"<p id="""">Gather all outdoor winter clothing in one place. Lay items flat on the floor, place them in a builder’s tuff tray, or hang them at child height on a dressing-up rail.</p><p id="""">Invite children to explore freely. Do not demonstrate unless a child asks or becomes stuck.</p><p id="""">Allow children to dress and undress themselves, try on items that do not “fit”, or wear clothes in unconventional ways. This exploration is part of the learning.</p><p id="""">Keep the area open for sustained play. Children may return to the activity several times.</p>","<ul><li>Stay emotionally available and observant. </li><li>Acknowledge effort more than outcome. </li><li>Model simple, functional language linked to what the child is doing: naming clothing items, body parts, and actions. </li><li>Offer help only when it is clearly needed, and do so slowly so the child remains involved. </li><li>Support social interaction by noticing sharing, waiting, and helping between children.</li><li> Hold the boundary around safety while keeping the atmosphere calm and unhurried.</li></ul>",,Children may insist on doing it themselves while needing reassurance. Support emotional regulation when frustration appears.,Children may insist on doing it themselves while needing reassurance. Support emotional regulation when frustration appears.,Introduce gentle prompts such as “What goes first?” or “Where does that part go?” to encourage sequencing and problem-solving.,Children may manage full outfits and support peers. Notice growing independence and sustained focus.,A clear indoor floor area with enough room for clothing to be spread out and children to move safely.,"20–30 minutes, with flexibility for children to dip in and out.","Check all clothing before use. Avoid broken zips, sharp fastenings, or tight elastic that could pinch skin. Ensure scarves and cords are supervised closely to reduce entanglement risk.","<h3>Physical Development</h3><p>Children practise fine motor control, coordination, and self-care through real dressing actions.</p><h3>Personal, Social &amp; Emotional Development</h3><p>The activity supports confidence, independence, and awareness of self, while offering opportunities for cooperation and empathy.</p><h3>Communication &amp; Language</h3><p>Children hear and use language linked to everyday actions, objects, and body awareness.</p>",,"<p id="""">Offer a limited selection of complete, well-fitting winter clothing, laid out neatly and consistently in the same order each time. Items are placed where children can reach them independently, with no duplicates and no excess choice.</p><p id="""">The adult demonstrates dressing actions slowly and precisely if invited, then steps back. Attention is on how the child sequences actions, persists with difficulty, and manages fastenings. The adult intervenes only to protect safety or when frustration clearly blocks progress.</p>",,"<p id="""">Arrange the clothing as a visual system rather than a pile. Hang coats at child height, place shoes directly below, and include a mirror positioned so children can see their whole body while dressing. Leave clear space between items so relationships are readable.</p><p id="""">The adult observes how children interpret the layout: whether they follow the visual order, move between related items, or use the mirror to adjust clothing. Language responds to these choices by naming connections the environment suggests, rather than giving instructions.</p>",,"<p id="""">Set the activity up close to the exit or outdoors, using the clothing children will actually wear next. Items may be placed on benches, logs, or mats, reflecting the outdoor setting and weather conditions.</p><p id="""">The adult supports dressing as part of preparing to go outside, not as a separate task. Attention is on how children respond to cold, wind, or wet ground, and how this affects their motivation to dress, persist, or seek help.</p>",,"<p id="""">Use a small range of natural-fibre clothing in muted colours. Lay items out calmly and consistently, avoiding visual clutter. The pace of the environment is slow and predictable.</p><p id="""">The adult uses a steady, rhythmic voice and minimal language, often narrating actions rather than questioning. Attention is on the child’s emotional state, noticing when calm repetition supports confidence or when the rhythm needs to pause to reduce frustration.</p>",false,false,,
